title,authors,year,citations,abstract,result_id,publication_info,pdf_links,url,total_results,search_time
Securing Network Domains: Towards In-Memory Packet Processing,K Kim,2025,0,… A versatile architecture is provided by attaching one or more Ethernet interfaces to a general-purpose FPGA. Major cloud providers extensively deployed Smart NICs based on this …,bXroaALTP4kJ,K Kim - 2025 - search.proquest.com,[],https://search.proquest.com/openview/576f5710dd96563b10cba5a65c68d56e/1?pq-origsite=gscholar&cbl=18750&diss=y,unknown,unknown
Software trusted startup and update protection scheme of IoT devices,"M Zhang, Y Zhang, S Li, Q Wan",2023,2,"… process between the TCM and server. In our scheme, the … and storage in the military IoT using symmetric cryptography. … Secure V2X communication network based on intelligent PKI …",0_ScpyDcZYsJ,"M Zhang, Y Zhang, S Li, Q Wan - … on Big Data Security on Cloud …, 2023 - ieeexplore.ieee.org",[],https://ieeexplore.ieee.org/abstract/document/10132124/,unknown,unknown
Powerful authentication regime applicable to naval OFP integrated development (PARANOID): A vision for non-circumventable code signing and traceability for …,"J Garcia, R Shannon, A Jacobson, W Mosca…",2021,3,"… The Department of Defense (DoD) recently included the use … used, the TCM may incorporate the use of a smart contract to … -based applications, the legacy PKI signature portion of some …",0c1Y45PmzKsJ,"J Garcia, R Shannon, A Jacobson, W Mosca… - Journal of Defense …, 2021 - emerald.com",[],https://www.emerald.com/jdal/article/5/1/46/205320,unknown,unknown
Tackling data mining risks: A tripartite covert channel merging blockchain and ipfs,"Z Chen, L Zhu, P Jiang, J He…",2025,20,"… We also propose a security model for TCCM to formalize … its input address pki and signature ri where km · pki = kiG. This … In our experiment, we utilize two Alibaba cloud servers, …",t1fWfHB1TxcJ,"Z Chen, L Zhu, P Jiang, J He… - IEEE Transactions on …, 2025 - ieeexplore.ieee.org",[],https://ieeexplore.ieee.org/abstract/document/10878429/,unknown,unknown
Platform attestation in consumer devices,"A Niemi, V Nayani, M Moustafa…",2023,5,"… consumer and government, or even military use? The problem is that … The TCM specifications are not fully available … Attest Root Certificate from Apple PKI. After successful validation, the …",_JGDDhKGld8J,"A Niemi, V Nayani, M Moustafa… - 2023 33rd Conference …, 2023 - ieeexplore.ieee.org",[],https://ieeexplore.ieee.org/abstract/document/10142995/,unknown,unknown
Verifiable Quantum ABE: Binding Policy Evaluation to Post-Quantum Cryptography for Adaptive Access Control,G Mogos,2025,0,"… ), Military information systems (multi-level security) and Cloud … In our system, TCM intervenes in the policy evaluation … , based on a hybrid PKI infrastructure using Dilithium for initial …",19N0drhc1x8J,"G Mogos - … Conference on Network and System Security, 2025 - Springer",[],https://link.springer.com/chapter/10.1007/978-981-95-6419-4_12,unknown,unknown
