System Name,Operator,Type,Scale,Key Technical Features,Security/Privacy,Status,References
Aadhaar,"UIDAI, India",Biometric ID System,1.3 billion+ enrolled residents,"12-digit unique ID; fingerprint, facial, iris biometrics; encrypted storage; access controls; regular audits; HTTPS protocol",Centralized biometric data; linkage attack risks; privacy concerns; demographic + biometric vulnerabilities,Active - evolving framework,[3]
Google Spanner,Google,Globally-Distributed SQL DB,Trillions of rows; millions of machines; hundreds of datacenters,TrueTime API with GPS/atomic clocks; externally-consistent distributed transactions; multi-version; synchronous replication; NewSQL standard,Encryption at rest/transit; IAM; audit logging,Production (Cloud Spanner),[5][10][13]
Amazon DynamoDB,Amazon Web Services,NoSQL Key-Value Store,Petabyte-scale; millions of requests/sec,Single-digit millisecond latency; automatic partitioning; replication across 3 AZs; ACID transactions (2017+); DAX caching; on-demand/serverless,Encryption at rest (KMS); VPC endpoints; fine-grained access control; CloudTrail logging,Production,[10]
CERN WLCG,CERN + global collaboration,Grid Computing,170+ computing centers; 40+ countries; 2M+ CPU cores; 1 EB+ storage,"MONARC model; tiered hierarchy (Tier-0/1/2/3); LHC data processing; ALICE, ATLAS, CMS, LHCb experiments; xrootd/GridFTP",PKI/X.509 certificates; VOMS; accounting/auditing,Active since 2002,[2]
SDSS,Sloan Digital Sky Survey collaboration,Astronomical Survey DB,1TB+ imaging data; 2M+ spectra; 35% of sky,SQL Server/Apache Hive; CasJobs query service; SkyServer web interface; Data Release iterations; optical spectroscopic surveys,Public access via web services; credential-based CasJobs,Active (SDSS-V),[External Knowledge]
SWIFT Network,Society for Worldwide Interbank Financial Telecommunication,Financial Messaging,"11,000+ institutions; 200+ countries; 42M+ messages/day",MT/MX message standards; FIN/YCopy service; CSP security program; two-factor auth; secure messaging; sanctions screening,CSP mandatory controls; segregation; customer security; transaction monitoring,Active,[External Knowledge]
DTCC,Depository Trust & Clearing Corporation,Financial Clearing,$2.3 quadrillion annual transaction value; 1.6M+ securities,DTC/NSCC/FICC; trade clearing/settlement; central counterparty; risk netting; Data Repository; Omgeo CTM,Comprehensive risk management; cyber resilience; regulatory compliance; SIFMU designation,Active,[External Knowledge]
