title,authors,year,citations,abstract,result_id,publication_info,pdf_links,url,total_results,search_time
The Rothschild Dynasty,J Coleman,2006,11,"… There is probably no name in international banking as well known as the Rothschild name, and yet so little of the true history of this family is known. There are many legends, myths and …",qZq3nApqescJ,J Coleman - 2006 - books.google.com,[],https://books.google.com/books?hl=en&lr=&id=DAMRAwAAQBAJ&oi=fnd&pg=PR12&dq=Rothschild+banking+dynasty+history&ots=YpRawNXmQy&sig=HW1VqVYtKl5A9tW6W6IeSdYqLWs,unknown,unknown
Nathan Mayer Rothschild and the creation of a dynasty: the critical years 1806-1816,HH Kaplan,2006,53,… HISTORY/EUROPE T HIS groundbreaking history explains how Nathan Mayer Rothschild … to become the founder of an extraordinary banking and financial empire-an empire that …,YmfEZb4UV1UJ,HH Kaplan - 2006 - books.google.com,[],https://books.google.com/books?hl=en&lr=&id=khxKMg6wjH4C&oi=fnd&pg=PR9&dq=Rothschild+banking+dynasty+history&ots=D1IsQpmLCW&sig=aiAAiDpK45Y8trJkAW3Y92khMos,unknown,unknown
The House of Rothschild: Volume 2: The World's Banker: 1849-1999,N Ferguson,2000,281,"… banking house: NM Rothschild. (His minister Buderus was a more willing investor in the … Of course, other dynasties behaved in similar ways. Cousin marriage was relatively common in …",yCbabpuKCJoJ,N Ferguson - 2000 - books.google.com,[],https://books.google.com/books?hl=en&lr=&id=orSqdFRW158C&oi=fnd&pg=PA1789&dq=Rothschild+banking+dynasty+history&ots=yy1nVdLhi2&sig=brNIJx13zLiPp8Ps0PTpH14yvVI,unknown,unknown
"Banking through the ages: from the Romans to the Medicis, from the Dutch to the Rothschilds",NF Hoggson,2007,12,… bank teller would speedily have felt at home in these surroundings. We are apt to think of Roman bankers … complicated commerce of Rome required a banking system of nearly as high a …,NhHQ5IjRu-QJ,NF Hoggson - 2007 - books.google.com,[],https://books.google.com/books?hl=en&lr=&id=4g-u4hYgw-4C&oi=fnd&pg=PA3&dq=Rothschild+banking+dynasty+history&ots=K3NERp0COv&sig=nELEVCcHmB1KWCq2MVjK72ngQ_0,unknown,unknown
History of Banking,A Verma,2017,1,"… Rothschild and Baring, established merchant banking firms in London in the late 18th century and came to dominate world banking … With the fall of the Qing dynasty, the financial centers …",CFbcYv1cEqkJ,"A Verma - History, 2017 - ijarasem.com",[],https://ijarasem.com/admin/img/18_History.pdf,unknown,unknown
Family banking in an era of crisis: NM Rothschild & Sons and business in central and eastern Europe between the World Wars,N Forbes,2013,10,"… Rothschild & Sons. When surveying the historical significance of banking families, no dynasty … that of the house of Rothschild: the London bank – NM Rothschild & Sons – continues to …",Hur1hxjEc2EJ,"N Forbes - Business History, 2013 - Taylor & Francis",[],https://www.tandfonline.com/doi/abs/10.1080/00076791.2012.744586,unknown,unknown
The rise of the Rothschilds: The family firm as multinational,N Ferguson,2016,10,"… Traditionally, the Spanish government leased the Almadén mines to private companies, most famously to the great banking dynasty of the sixteenth century, the Fuggers.It was a …",X2K1QJQl_UQJ,"N Ferguson - The world of private banking, 2016 - api.taylorfrancis.com",[],https://api.taylorfrancis.com/content/chapters/edit/download?identifierName=doi&identifierValue=10.4324/9781315236520-9&type=chapterpdf,unknown,unknown
